id_palabra,"Palabra","id_cronista","id_texto","cita","pagina","lengua","propuesta","nota","enlace"
1202,"Guamanga","1","T01516","Ay otros géneros de <i>guacas</i>, a quién reverencian y sirven con mucho cuidado, que son de los frutos primeros que coxen de alguna tierra que no fue sembrada.  Escoxen el más hermoso fruto y le guardan y, a semejança dél, hizieron otros de piedras diferentes o de oro o plata, como una maçorza de <i>maíz</i> o una papa y les llaman <i>mamaçara</i> y <i>mamapapa</i>; y así a los demás frutos y en esta forma de todos los minerales de oro o plaza o azogue que antiquísimamente se han descubierto.  Y, primero que los vayan a labrar, el día que han de trabajar, mochan y beven a la tal piedra llamándola mama de lo que travajan.  He descubierto muchos dellos en todas las partes donde hay minas, en tierras de <b>Guamanga</b>.","195","","","","sin datos"
1202,"Guamanga","1","T01517","Visitando yo, el año de 68, la ciudad de <i>Arequipa</i>, por la sede vacante desta santa iglesia y sus <i>provincias</i>, governando el señor Licenciado Castro, me mandaron ir a la ciudad de <b>Guamanga</b> a visitarla y las <i>provincias</i> della donde me ocupé los años de 69 y 70 y parte del 71, porque fue Dios servido que en aquellas <i>provincias</i> hallase una apostassia predicada entre los naturales que los tenía a los más naturales dellas pervertidos y apartados de nuestra fee y religión cristiana.","215","","","","sin datos"
1202,"Guamanga","1","T01518","Y como estos maestros pretendían concluir su hecho, y saviendo la fuerça que entre los naturales tienen los <i>hechizeros</i> <i>camayos</i> de <i>guacas</i> y las <i>guacas</i> suyas naturales, para que no oviese otros que mandasen ni predicasen otra religión que la del <i>ynga</i>, porque muchos en sus <i>provincias</i> avían olvidado las celebraciones de las <i>guacas</i> del <i>ynga</i>, pedían en las <i>provincias</i> que allegavan y eran bien recebidos, los nombres de las <i>guacas</i> y de sus <i>camayos</i> con sus servicios y de las <i>haziendas</i> que teman, y luego juntavan a los tales <i>camayos</i> y se hazía el baile y se enborrachavan y matávanlos sin que nayde le[s] resistiese.  Esto hicieron en las <i>provincias</i> de los <i>lucanas</i> y de los <i>soras</i> y en la vertiente de los <i>papache</i> y todos e otros pueblos de <b>Guamanga</b>.","216","","","","sin datos"
1203,"Guamani","1","T01519","<b>Guamani</b> <i>guaca</i>, de los dichos <i>omasayos</i>, era un agujero en una ladera junto al pueblo de <i>Chuerqui</i>.","207","","","","sin datos"
1204,"Guamas","1","T01520"," <b>Guamas</b>, <i>guaca</i>  prencipal de <i>Caylloycoc guanoco</i>, es una piedra questá en un cerro pequeño junto al pueblo de <i>Chuchua</i>. ","210","","","","sin datos"
1205,"Guana cauri","1","T01521","<b>Guana cauri</b>, <i>Anaguarque</i> e <i>Auiraca</i>, <i>guacas</i> en el dicho valle, tres piedras en un cerro en memoria de las del <i>Cuzco</i>.","205","","","","sin datos"
1206,"Guanacauri","1","T01522","<i>Maragoaçi guanacauri</i>, piedra donde hazían muchos sacrificios en reverencia del <b>Guanacauri</b> del <i>Cuzco</i>.","205-206","","","","sin datos"
1207,"Guanaco/Guanoco","1","T01523","Ay otra <i>guaca</i> general en los <i>caminos reales</i> y en las plaças de los pueblos, que llaman <i>uznos</i>.  Eran de figura de un bolo hecho de muchas diferencias de piedras o de oro y de plata.  A todos les tenían hechos edificios en donde tengo dicho en muchas partes como en <i>Bilcas</i> y en <i>Pucara</i> y en <b>Guanaco</b> el Viejo y en <i>Tiaguanaco</i>, a hechura de torres de muy hermosa cantería. Sentávanse los <i>señores</i> a bever a el sol en el dicho <i>uzno</i> y hazían muchos sacrificios a el sol.","202","","","","sin datos"
1207,"Guanaco/Guanoco","1","T01524","<i>Yarobaha</i>, <i>guaca</i> prencipal de los indios<i> hurinsayas</i> de <b>Guánoco</b>, es una piedra en un cerro nevado.  Está junto al pueblo <i>Hurcumanor</i> [?].","209","","","","sin datos"
1208,"Guancachupa","1","T01525","<i>Chunchucota</i>, <i>guaca</i> de los indios <i>chupaichos</i>, era una piedra questava frontero del pueblo <b>Guancachupa</b>.","209","","","","sin datos"
1209,"Guancalchare","1","T01526","<b>Guancalchare</b>, <i>guaca</i> prencipal de los indios de <i>Yca</i>, es una piedra gran y alta questá en un algarroual junto al pueblo de San Martín.","214","","","","sin datos"
1210,"Guancayo","1","T01527","<i>Guarivilca</i>, <i>guaca</i> muy prencipal de los dichos <i>anaguancas</i>, es una piedra como indio.  Está en un llano junto al tambo <b>Guancayo</b>, cerca, en un corral.","208","","","","sin datos"
1211,"guanocos pincos","1","T01528","<i>Ancouilca</i>, <i>guaca</i> prencipal de los indios <b>guanocos pincos</b>, es una piedra questá en un cerro pequeño junto al pueblo de <i>Pincos</i>. ","209","","","","sin datos"
1211,"guanocos pincos","1","T01529","<i>Chauin</i>, <i>guaca</i> prencipal de los indios <b>guanocos pincos</b>, es una piedra questá en un cerro pequeño junto al pueblo de <i>Pincos</i>.","209","","","","sin datos"
1212,"Guapaaylli","1","T01530","<b>Guapaaylli</b>, <i>guaca</i> de los indios <i>checas</i> del <i>ayllo</i> de <i>Mancheca</i>.","212","","","","sin datos"
1213,"guaquillas","1","T01531","Y juntamente les dio unas <b>guaquillas</b> de piedras de diferenciados colores que les llamo <i>auqui</i>, que los traían con sus personas en las <i>chuspas</i>, como los cristianos tienen figuras de santos a quienes reverencian.  Servían de paramentos y promesas que hazían en los <i>auquis</i> de tratar verdad en las juntas que hazían para todo género de govierno. Ay muchos destos entre los naturales y son de mucho daño por la fe que en ellas tienen; dávanse en <i>Pachacama</i> en los llanos y en <i>Curicanche</i> [sic] en el <i>Cuzco</i> por sus sacerdotes guacamayos [sic: <i>guaca camayos</i>].","194","","","","sin datos"
1214,"Guara","1","T01532","Y asimismo en la suprestición de la tresquila que hazen a los niños, que se llaman <i>rutuchicos</i>, que entonces les ponen los nombres de sus pasados o <i>guacas</i> y les hazen ofrecimientos y otras ceremonias.  También se a de advertir en las cerimonias que hazen cuando les ponen la <b>guara</b>, que es un género de paños como çaraguelles, que se hazen muchas ceremonias.  Llámese <i>guarachico</i> y a las mujeres se llama <i>quiquchicuy</i> cuando les comiençan su menstruidad.","202","","","","sin datos"
1215,"Guaracayoc","1","T01533","<b>Guaracayoc</b>, <i>guaca</i> de los indios <i>guamachucos</i>, era su <i>pacarisca</i>.","210","","","","sin datos"
1216,"guarachico","1","T01534","Y asimismo en la suprestición de la tresquila que hazen a los niños, que se llaman <i>rutuchicos</i>, que entonces les ponen los nombres de sus pasados o <i>guacas</i> y les hazen ofrecimientos y otras ceremonias.  También se a de advertir en las cerimonias que hazen cuando les ponen la <i>guara</i>, que es un género de paños como çaraguelles, que se hazen muchas ceremonias.  Llámese <b>guarachico</b> y a las mujeres se llama <i>quiquchicuy</i> cuando les comiençan su menstruidad.","202","","","","sin datos"
1217,"Guaracinci","1","T01535","<b>Guaracinci</b>, una piedra labrada a la puerta del Sol.","205","","","","sin datos"
1218,"Guariguaca","1","T01536","<b>Guariguaca</b>, agujero en la fortaleza de donde dizen sale el biento.","205","","","","sin datos"
1219,"guariguanocos","1","T01537","<i>Chauin</i>, <i>guaca</i> prencipal de los indios <b>guariguanocos</b>, es una piedra questá en una plaça que se llama <i>Ayas pampa</i>.  Llámase el pueblo <i>Ayas</i>.","209","","","","sin datos"
1220,"Guarivilca","1","T01538","<b>Guarivilca</b>, <i>guaca</i> muy prencipal de los dichos <i>anaguancas</i>, es una piedra como indio.  Está en un llano junto al <i>tambo</i> <i>Guancayo</i>, cerca, en un corral.","208","","","","sin datos"
1221,"guarocondos","1","T01539","<i>Oyñacaca</i>, <i>guaca</i> de los indios <b>guarocondos</b>; es una peña al pie de un cerro.","205","","","","sin datos"
1222,"Guasaynan","1","T01540","<b>Guasaynan</b>, <i>guaca</i> prencipal de todos los indios <i>hurin</i> e <i>hanansayas</i>. Es un cerro alto de donde dizen proceden todos los <i>cañares</i> y donde dizen huyeron del diluvio y otras supresticiones que tienen en el dicho cerro. ","211","","","","sin datos"
1223,"guayllas","1","T01541","<i>Matarau</i>, <i>guaca</i> prencipal de los dichos indios <b>guayllas</b>, es una piedra questá en el dicho cerro <i>Mataras</i>.  Está cercada, junto al pueblo de <i>Yzcas</i>. ","209","","","","sin datos"
1224,"Guayllasi","1","T01542","<i>Barasuybira</i>, <i>guaca</i> de los <i>cañares</i> del <i>ayllo</i> de <b>Guayllasi</b>, es una piedra questá en el cerro <i>Barasuibira</i>, junto al pueblo de <i>Guallas</i>.","211","","","","sin datos"
1225,"Guayoay uilca","1","T01543","<b>Guayoay uilca</b>, <i>guaca</i> prencipal de los <i>taramas</i>, es un cerro questá drontero del <i>tambo</i> de <i>Tarama</i>.","209","","","","sin datos"
1226,"Guaypon","1","T01544","<i>Chinchero Gauancoari</i> es una piedra cerca de la dicha <i>guaca</i> de la laguna <b>Guaypon</b>. Tiene otras muchas <i>guacas</i> por allegados ansí.","206","","","","sin datos"
1227,"Guaypon guanacauri","1","T01545","<b>Guaypon guanacauri</b> , piedra cerca de una laguna.  Aquí se horradavan las orejas los indios <i>Cuzcos</i>.","206","","","","sin datos"
1228,"Guaytara","1","T01546","Choclo cacha [sic: <i>Choclo cocha</i>], laguna grande en la puna de <b>Guaytara</b>, de grande beneración, que nascen della ríos, y le hazían muchos sacrificios.  Hay alrededor della muchos minerales de plata, según dizen los antiguos.","208","","","","sin datos"
1229,"Guica","1","T01547","<b>Guica</b>, <i>guaca</i> de los dichos <i>anansayas</i> del <i>ayllo</i> de <i>Cauansibi</i>, es un cerro grande.  Son piedras junto al pueblo de <i>Cauanssibe</i>.","211","","","","sin datos"
1230,"Guixicoc","1","T01548","<b>Guixicoc</b>, <i>guaca</i> de los dichos <i>Chachapoyas</i> del <i>ayllo</i>  [......]. ","212","","","","sin datos"
1231,"Hacari","1","T01549","<i>Guali chanchau</i>, <i>guaca</i> prencipal de los indios de <b>Hacari</b>, era un <i>bulto</i> como indio.  Tenía <i>casa</i> en el pueblo de <i>Cusillo</i>.  Tenía mucha <i>hazienda</i> y criados. ","213","","","","sin datos"
1231,"Hacari","1","T01550","<i>Sañoc ancauilca</i>, <i>guaca</i> de los indios de <i>la Nasca</i>, <i>provincia</i> de <b>Hacari</b>.  Es un cerro; en él está una piedra junto al pueblo de <i>Tarana</i>.","213","","","","sin datos"
1232,"hacaris","1","T01551","<i>Luhutare</i> era <i>guaca</i> de los indios <b>hacaris</b>.  Era un cerro de arena, una peña en él.  ","213","","","","sin datos"
1232,"hacaris","1","T01552","<i>Chaunicac llanguiama</i> es una isla questá metida en el mar, <i>guaca</i> de los indios <b>hacaris</b>. ","213","","","","sin datos"
1233,"Hallaoca","1","T01553","<i>Yarouilca</i>, <i>guaca</i> prencipal de los dichos <i>atauillos</i>, es un cerro nevado grande, junto al pueblo de <b>Hallaoca</b>. ","209","","","","sin datos"
1234,"Hambato","1","T01554","Ay otra sobre los <i>Collaguas</i> que se llama <b>Hambato</b> que mira al mar, del propio orden de servicio. ","198","","","","sin datos"
1235,"Hanan","1","T01555","Llámase <i>parcialidad</i> por el orden que el <i>ynga</i> les puso, en legiones que ordenó en las repúblicas y <i>provincias</i> que hizo, que fue nombrallas mayores y menores -que es negoscio largo tratar desto- que les intituló <b>hanan</b> o <i>hurin</i>, <i>hanansaya</i> o <i>hurinsaya</i>.  Ovo <i>parcialidad</i> de diez mil indios y de mil y ciento y de diez y de cinco y de la menor iba en recogimiento de la mayor y de la mayor a la menor.","198","","","","sin datos"
1236,"Hanan Chaca","1","T01556","<b>Hanan Chaca</b> y <i>Hurinchaca</i>, dos nacimientos de fuentes.  ","205","","","","sin datos"
1237,"Hanansaya","1","T01557","Llámase <i>parcialidad</i> por el orden que el <i>ynga</i> les puso, en legiones que ordenó en las repúblicas y <i>provincias</i> que hizo, que fue nombrallas mayores y menores -que es negoscio largo tratar desto- que les intituló <i>hanan</i> o <i>hurin</i>, <b>hanansaya</b> o <i>hurinsaya</i>.  Ovo <i>parcialidad</i> de diez mil indios y de mil y ciento y de diez y de cinco y de la menor iba en recogimiento de la mayor y de la mayor a la menor.","198","","","","sin datos"
1238,"Hatun xauxa","1","T01558","<i>Cucuvilca</i>, <i>guaca</i> de los dichos indios de <i>Xauxa</i>, son muchas piedras que cercan a otra grande, questá cerca del pueblo de <b>Hatun Xauxa</b>.","208","","","","sin datos"
1239,"haziendas ","1","T01559","Los <i>yngas</i> como subcedían los unos a los otros fueron inbentando muchos géneros de <i>guacas</i> que generalmentemandó que las adorasen en toda la tierra que poseyó, de las cuales dio en todas o las más <i>provincias</i>, conforme a la posibilidad de la tierra cuyos nombres porné muchos, y de cada un nombre.  Ay muchas en toda la tierra, unas bencidas como ellos llaman <i>atisca</i>, otras en pie.  A todas estas les dio servicios y <b>haziendas</b> y basos de oro y plata y a muchas <i>ganados</i> en la forma en que diré.","194-195","","","","sin datos"
1239,"haziendas ","1","T01560","Ay otros géneros de <i>guacas</i> a quién también dio servicio y <b>haziendas</b>, que pocas están descubiertas, aunque en la <i>provincia</i> de <i>Guamanga</i> descubrí algunas, que son, cuando iban los <i>yngas</i> conquistando, dexavan alguna uña cortada suya o alguna pieça de bestido suyo o pieça de armas o alguna ala de halcón.  [D]esta ala de halcón usa dicha cirimonia, que a los que vencía, escogía a uno a quien dexava en su lugar y le dezía:-Hazid desta ala de halcón bivo y tirad della hasta que saquéis-; queda el <i>ynga</i> con la una y al que nombrava con la otra, y deziale:-mirad como esta ave es la más noble y leal de las aves, ansí lo has de ser conmigo, que me fío de ti-","195","","","","sin datos"
1239,"haziendas ","1","T01561","Ay otro género de <i>guacas</i>, en estos indios <i>mitimas</i> quel <i>ynga</i> pasó de unas tierras o otras, de mucha importancia e que más disimuladas tienen que son algunas pieça de bestidura que su <i>guaca</i> <i>pacarisca</i> tenía en sus tierras, la qual pieça les entregava el sacerdote o el <i>camayo</i> de la dicha <i>guaca</i> en su tierra, encargándoles no se les olvidase el nombre de su descendencia e que en el propio orden que en sus tierras mochavan y reverenciavan a su <i>pacarisca</i> criadora, ansí lo hiziesen, sacando en sus bailes y <i>taquíes</i> generales aquella pieça de bestidura de su <i>guaca</i>.  Guardan estas pieças con mucho cuidado e les tienen dados servicios y <b>haziendas</b>.","199","","","","sin datos"
1239,"haziendas ","1","T01562","Y ase de entender que, fuera de los <i>mitimas</i> y servicios quel <i>ynga</i> dio a las dichas <i>guacas</i>, tienen otros servicios que llaman criados o <i>camayos</i>, que sirven de guardar las dichas <i>guacas</i> y sus <b>haziendas</b>, fuera de los guardadores del <i>ganado</i>.  En estos criados ban subcediendo los hijos o nietos de los tales, y ansí no se pierde la memoria.  E cuando fallescen, la nasción de unos, los <i>curacas</i>, les ofrescen otros que entre ellos parescen ser religiosos. ()","200","","","","sin datos"
1239,"haziendas ","1","T01563","Hubo tres <i>yngas</i> más prencipales del apellido del <i>amaro</i>, como fueron <i>Nina Amaro</i>, <i>Tupa Amaro</i> y <i>Cusi Amaro</i>, y éste [...] en el [?] de <i>Vilcabamba</i> que mando [?] el señor visorrey don Francisco de Toledo, que se llamaua <i>Tupa Amaro</i>. E ovo de este nombre muchos prencipales e indios e traen a dichas culebras por sus divisas y armas todos los <i>yngas</i>, y hay muchas <i>guacas</i>destos nombres en todo el <i>Pirú</i>, con muchos servicios y <b>haziendas</b>.","201","","","","sin datos"
1239,"haziendas ","1","T01564","<i>Tambocancha</i>, <i>casa</i> que fue de un <i>ynga</i> y tenía su figura de oro en la dicha <i>casa</i>; llamáse <i>Tupa Ynga Yupanqui</i>.  Tenía muchas <b>haziendas</b> y riquezas esta <i>casa</i> y <i>camayos</i>.","205","","","","sin datos"
1239,"haziendas ","1","T01565","<i>Topa Ynga Yupanqui</i>.  Era una piedra en figura del dicho <i>ynga</i>, que fue el que ganó a el Sol la dicha <i>provincia</i>, como está referido.  Tenían en mucha veneración este <i>bulto</i>, y con muchas <b>haziendas</b>.  ","207","","","","sin datos"
1239,"haziendas ","1","T01566","Y como estos maestros pretendían concluir su hecho, y saviendo la fuerça que entre los naturales tienen los <i>hechizeros</i> <i>camayos</i> de <i>guacas</i> y las <i>guacas</i>suyas naturales, para que no oviese otros que mandasen ni predicasen otra religión que la del <i>ynga</i>, porque muchos en sus <i>provincias</i> avían olvidado las celebraciones de las <i>guacas</i>del <i>ynga</i>, pedían en las <i>provincias</i> que allegavan y eran bien recebidos, los nombres de las <i>guacas</i> y de sus <i>camayos</i> con sus servicios y de las <b>haziendas</b> que teman, y luego juntavan a los tales <i>camayos</i> y se hazía el baile y se enborrachavan y matávanlos sin que nayde le[s] resistiese.  Esto hicieron en las <i>provincias</i> de los <i>lucanas</i> y de los <i>soras</i> y en la vertiente de los <i>papache</i> y todos e otros pueblos de <i>Guamanga</i>.","216","","","","sin datos"
1239,"haziendas ","1","T01567","Destos dogmatizadores del diablo tomé el principio de saber preguntar y descubrir las <i>guacas</i> e <i>camayos</i> dellas y no me metí en saber las <b>haziendas</b> por la poca autoridad que tenía en les apremiar para esto y para que entendiesen los naturales que no pretendía más de la salvación de sus ánimas, apartándoles de sus supresticiones.  De manera que por lo dicho los curas cristianos y zelosos de la honra de Dios que quieren hazer bien sus oficios, les será fácil el saver las <i>guacas</i> que puede aver en su distrito y los <i>camayos</i> que tienen y el orden que tenían en hazelles sacrificios y fiestas y la <b>hazienda</b> que poseyeron las <i>chácaras</i> y <i>ganados</i> y basos y ropas.","217","","","","sin datos"
1239,"haziendas ","1","T01568","Ase de advertir que todas las más <i>guacas</i>, fuera de sus <b>haziendas</b>, tienen bestidos de cumbe que llaman <i>capaccochas</i>, del grandor de las <i>guacas</i>.  Y lo primero que se a de procurar es estas <i>capaccochas</i> porque, quedando en su poder, tornarán a bestir la piedra que quisieren, de manera que no quede reliquia de la tal <i>guaca</i>.","217","","","","sin datos"
1239,"haziendas ","1","T01569","Y a muchas <i>guacas</i> de las dichas ennobleció con muchos servicios y <b>haziendas</b> y basos de oro y plata y ofreciendole[s] sus propias personas en figuras de oro o de plata y otras figuras de carneros y de otros animales y aves del dicho oro y plata, e ofreciendo y quemando de todos los mantenimientos que ellos usavan, y dándoles bestidos ricos que para el efeto mandavan hazer.","194","","","","sin datos"
1240,"hechizeros","1","T01570","Tienen otro género de <i>guacas</i> que llaman <i>uilcas</i>, que aunque la <i>uilca</i> es un género de fruta ponçoñosa que nace y se da en los <i>Andes</i> tierra caliente, de hechura de una blanca de cobre de Castilla, cúranse y púrganse con ella y se entierran con ella en las más <i>provincias</i> de este <i>reino</i>.   Ase de advertir que unas figuras como carneros de madera y piedra y [que ] tienen un hueco como tintero, ques donde se muele esta <i>uilca</i>, se a de procurar buscar y destruir.  Llámase el tintero <i>uilcana</i> y la adoran y reverencian.  Es esta <i>uilcana</i> hecha de muchas diferencias de piedras hermosas y de maderas fuertes.  Tienen, fuera de esta <i>uilca</i>, otros muy muchos géneros de medicinas que les llaman <i>uilcas</i>, en especial de purgas.   Ay muchos géneros de médicos que todos son <b>hechizeros</b> que usan de curar e inbocan al demonio primero que comiencen a curar, y esto es cierto y…","200","","","","sin datos"
1240,"hechizeros","1","T01571","Vino esta denominación de un abuso que imbentaron unos <b>hechizeros</b> en una peña questá en <i>Paucara</i> en el <i>Collao</i>, donde se juntava[n] cuatro dellos los más nombrados de aquellas <i>provincias</i>, y con unas yervas a figura de tallos y el cavo con una paletilla como espatula de boticario, que los indios se la ponen en la caveça por plumas y gala, y con estas en las manos, començavan a llorar a inbocar sus <i>guacas</i>, dando golpes en un agujero de la dicha peña, que del humor de las yervas salían unos mosquitos y a estos llamavan <i>guacanqui</i> como a cosa salida llorando.  A estos guardavan y los traían los <i>yngas</i> y personas prencipales consigo para que los amasen las mujeres y para ser bien afortunados en guerra y en sus contrataciones;","200","","","","sin datos"
1240,"hechizeros","1","T01572","Y como estos maestros pretendían concluir su hecho, y saviendo la fuerça que entre los naturales tienen los <b>hechizeros</b> <i>camayos</i> de <i>guacas</i> y las <i>guacas</i> suyas naturales, para que no oviese otros que mandasen ni predicasen otra religión que la del <i>ynga</i>, porque muchos en sus <i>provincias</i> avían olvidado las celebraciones de las <i>guacas</i> del <i>ynga</i>, pedían en las <i>provincias</i> que allegavan y eran bien recebidos, los nombres de las <i>guacas</i> y de sus <i>camayos</i> con sus servicios y de las <i>haziendas</i> que teman, y luego juntavan a los tales <i>camayos</i> y se hazía el baile y se enborrachavan y matávanlos sin que nayde le[s] resistiese.  Esto hicieron en las <i>provincias</i> de los <i>lucanas</i> y de los <i>soras</i> y en la vertiente de los <i>papache</i> y todos e otros pueblos de <i>Guamanga</i>.","216","","","","sin datos"
1240,"hechizeros","1","T01573","Esta crueldad de que usavan estos maestros del demonio, lo hazían por ser <i>señores</i> y que no eviese quien supiese orden de matallos con vervas o con otras cosas, porque no temen los naturales tanto las armas y géneros de muertes dellas como los modos y maldades de que usavan los <b>hechizeros</b> para matar a quien quieren.","217","","","","sin datos"
1241,"Hequeco","1","T01574","<i>Uilcacayan</i>, <i>guaca</i> de los indios de <b>Hequeco</b>; es una piedra encorvada.","205","","","","sin datos"
1241,"Hequeco","1","T01575","<i>Mapiguaca</i>, del mismo pueblo de <b>Hequeco</b>, piedra figura de indio.","205","","","","sin datos"
1242,"Hurcumanor","1","T01576","<i>Yarobaha</i>, <i>guaca</i> prencipal de los indios<i> hurinsayas</i> de <i>Guánoco</i>, es una piedra en un cerro nevado.  Está junto al pueblo <b>Hurcumanor</b> [?]. ","209","","","","sin datos"
1243,"hurin","1","T01577","Llámase <i>parcialidad</i> por el orden que el <i>ynga</i> les puso, en legiones que ordenó en las repúblicas y <i>provincias</i> que hizo, que fue nombrallas mayores y menores -que es negoscio largo tratar desto- que les intituló <i>hanan</i> o <b>hurin</b>, <i>hanansaya</i> o <i>hurinsaya</i>.  Ovo <i>parcialidad</i> de diez mil indios y de mil y ciento y de diez y de cinco y de la menor iba en recogimiento de la mayor y de la mayor a la menor.","198","","","","sin datos"
1243,"hurin","1","T01578","<i>Guasaynan</i>, <i>guaca</i> prencipal de todos los indios <b>hurin</b> e <i>hanansayas</i>.  Es un cerro alto de donde dizen proceden todos los <i>cañares</i> y donde dizen huyeron del diluvio y otras supresticiones que tienen en el dicho cerro.  ","211","","","","sin datos"
1243,"hurin","1","T01579","Después de savidos los nombres de las <i>guacas</i> y de los lugares, no se an de satisfazer sin verlos por los ojos e allí deshazerlas, si no fueren portátiles, para que delante del pueblo se quemen.  Porque la comunidad tiene en poco la <i>guaca</i> que una vez fue vencida, que llaman ellos <i>atisca</i>.  Ase de quemar con todas las reliquias de los bestidos que se hallaren, porque a una sola sembría [sic] adorarán si la ven ques semilla del diablo; y después dessas todas estas diligencias en el libro de la fábrica de la iglesia, al cavo dél, se an de poner por memoria de sus <i>ayllos</i> y <i>parcialidades</i> de <b>hurin</b> y de <i>hanan</i> subcesivamente, dende la <i>pacarisca</i> hasta las demás y poniendo el nombre de la <i>guaca</i>, luego de lo que servía la tal <i>guaca</i> y al pie de cada qual el nombre de sus <i>camayos</i>.  ","217","","","","sin datos"
1244,"Hurinchaca","1","T01580","<i>Hanan Chaca</i> y <b>Hurinchaca</b>, dos nacimientos de fuentes.  ","205","","","","sin datos"
1245,"hurinchangas","1","T01581","<i>Ancovilca</i> era <i>guaca</i> de los indios <b>hurinchangas</b>.  Era una piedra que traían consigo donde quiera que iban y tenía <i>casa</i>.","207","","","","sin datos"
1246,"huringuaillas","1","T01582","<i>Macouilca</i>, <i>guaca</i> prencipal de los indios <b>huringuaillas</b>, es una piedra bestida.","209","","","","sin datos"
1247,"huringuancas","1","T01583","<i>Zunis</i>, es una <i>guaca</i> de los indios <b>huringuancas</b>; es una piedra questá en un cerrillo, cerca de <i>Amarayuilca</i>.","208","","","","sin datos"
1248,"hurinsaya","1","T01584","Llámase <i>parcialidad</i> por el orden que el <i>ynga</i> les puso, en legiones que ordenó en las repúblicas y <i>provincias</i> que hizo, que fue nombrallas mayores y menores -que es negoscio largo tratar desto- que les intituló <i>hanan</i> o <i>hurin</i>, <i>hanansaya</i> o <b>hurinsaya</b>.  Ovo <i>parcialidad</i> de diez mil indios y de mil y ciento y de diez y de cinco y de la menor iba en recogimiento de la mayor y de la mayor a la menor.","198","","","","sin datos"
