id_palabra,"Palabra","id_cronista","id_texto","cita","pagina","lengua","propuesta","nota","enlace"
1329,"Patadi","1","T01713","<i>Llanganati</i>, <i>guaca</i> prencipal de los indios <i>munchas</i>, en la dicha <i>provincia</i>.  Es un cerro nevado entre unas arboledas, junto al pueblo de <b>Patadi</b>.  ","213","","","","sin datos"
1330,"Paucara","1","T01714","Vino esta denominación de un abuso que imbentaron unos <i>hechizeros</i> en una peña questá en <b>Paucara</b> en el <i>Collao</i>, donde se juntava[n] cuatro dellos los más nombrados de aquellas <i>provincias</i>, y con unas yervas a figura de tallos y el cavo con una paletilla como espatula de boticario, que los indios se la ponen en la caveça por plumas y gala, y con estas en las manos, començavan a llorar a inbocar sus <i>guacas</i>, dando golpes en un agujero de la dicha peña, que del humor de las yervas salían unos mosquitos y a estos llamavan <i>guacanqui</i> como a cosa salida llorando.  A estos guardavan y los traían los <i>yngas</i> y personas prencipales consigo para que los amasen las mujeres y para ser bien afortunados en guerra y en sus contrataciones;","200","","","","sin datos"
1331,"Paucararay","1","T01715","<i>Caroamcho</i>[?], <i>guaca</i> de los indios <i>angaraes</i>, es un cerro frontero del pueblo de <b>Paucararay</b>. ","208","","","","sin datos"
1332,"Paucarbamba","1","T01716","<i>Jorai</i>, <i>guaca</i> de los indios pariscas de Diego Favilán.  Es un cerro nevado junto al pueblo de <b>Paucarbamba</b>.  ","208","","","","sin datos"
1333,"Paycara","1","T01717","<i>Uisiguiumai</i> es <i>guaca</i> de los indios <i>cañares</i> del <i>ayllo</i> de <b>Paycara</b>.  Es un cerro grande, [hay] en él unas piedras junto al pueblo de <i>Anucñoc</i>. ","211","","","","sin datos"
1334,"Pichus","1","T01718","<b>Pichus</b>, <i>guaca</i> de los indios <i>huriguancas</i>, es una piedra en un cerro, en frente de la <i>guaca</i> <i>Zunis</i>.  ","208","","","","sin datos"
1334,"Pichus","1","T01719","<i>Quixurarvilca</i>, <i>guaca</i> de los dichos indios, cerca de la <i>guaca</i> <b>Pichus</b>, es un cerrillo. ","208","","","","sin datos"
1335,"Pilco guarda","1","T01720","<b>Pilco guarda</b>, <i>guaca</i> de los indios de <i>Conchacalca</i>, una piedra puesta en un cerro grande.","205","","","","sin datos"
1336,"Pilco puquio","1","T01721","<b>Pilco puquio</b>  es una fuente.","205","","","","sin datos"
1337,"Pincos","1","T01722","<i>Ancouilca</i>, <i>guaca</i> prencipal de los indios <i>guanocos pincos</i>, es una piedra questá en un cerro pequeño junto al pueblo de <b>Pincos</b>. ","209","","","","sin datos"
1337,"Pincos","1","T01723"," <i>Chauin</i>, <i>guaca</i> prencipal de los indios <i>guanocos pincos</i>, es una piedra questá en un cerro pequeño junto al pueblo de <b>Pincos</b>. ","209","","","","sin datos"
1338,"Piru","1","T01724","Ay, como dixe arriba, el prencipal género de <i>guacas</i> que antes que fuesen subjetos al <i>ynga</i> tenían, que llaman <i>pacariscas</i>, que quieren dezir criadoras de sus naturalezas.  Son en diferentes formas y nombres conforme a las <i>provincias</i>: unos tenían piedras, otros fuentes y rios, otros cuebas, otros animales y aves e otros géneros de árboles y de yervas y desta diferencia tratavan ser criados y descender de las dichas cosas, como los <i>yngas</i> dezia[n] ser salidos de <i>Pacaritambo</i>, ques de una cueba que se dize <i>Tambo Toco</i> y los <i>angaraes</i> y <i>soras</i> descender de una laguna llamada <i>Choclo Cocha</i> y desta manera todas las <i>provincias</i> del <b>Pirú</b>, cada cual de su modo aplicando cualquiera de las cosas dichas a su nascimiento.","197","","","","sin datos"
1338,"Piru","1","T01725","Hubo tres <i>yngas</i> más prencipales del apellido del <i>amaro</i>, como fueron <i>Nina Amaro</i>, <i>Tupa Amaro</i> y <i>Cusi Amaro</i>, y éste [...] en el [?] de <i>Vilcabamba</i> que mando [?] el señor visorrey don Francisco de Toledo, que se llamaua  <i>Tupa Amaro</i>. E ovo de este nombre muchos prencipales e indios e traen a dichas culebras por sus divisas y armas todos los <i>yngas</i>, y hay muchas <i>guacas</i> destos nombres en todo el <b>Pirú</b>, con muchos servicios y <i>haziendas</i>.","201","","","","sin datos"
1338,"Piru","1","T01726","<i>Uilca conga</i>, <i>guaca</i> general de todo el <b>Pirú</b> y le hazía todo el <b>Pirú</b> <i>cacchaui</i> y le ofrecían y servían.  Es donde dieron la batalla a los españoles.","205","","","","sin datos"
1338,"Piru","1","T01727","Ay otro género de <i>guacas</i>muy ordenario en todos los caminos y puertos dellos en todo el <b>Pirú</b>, que llaman <i>apachita</i> o <i>camachico</i> por otro nombre.  Estas las ay en todas las asomadas y bertientes de los caminos, a las cuales saludan y ofrescen los que van con cargas o fatigados de andar, y les ofrescen una oración o una piedra, de tal manera que en los dichos lugares ay muchos más montes dellas.  Otros escarvan la tierra en la propia <i>guaca</i> y, escarvándola, cuenta[n] sus travajos o prosperidades a la dicha <i>guaca</i>.  Otros hazen nudos a las pajas questán cerca.  Otros ofrescen ramos de leña, otros flores o plumas de <i>pariguanas</i>, que son de unas aves que llaman flamencos en España.  Otros, <i>acollicos</i> de <i>coca</i> o <i>maíz</i>; el <i>acollico</i> es un poco de <i>coca</i> mascada o lo que cada cual tiene por devoción.","197","","","","sin datos"
1338,"Piru","1","T01728","Ay deste género en los <i>caminos reales</i> otras <i>guacas</i> llamadas <i>ormaychico</i> debaxo de peñas o de cerros que amenazan caídas, que los indios mochan y sirven con aquellos bocados de <i>coca</i> que llaman <i>acollicos</i> o con otros mantenimientos que bayan comiendo.  Es imposible tirarles esta superstrición porque para tirar las <i>guacas</i> es necesario mucha fuerza de gente que toda la del <b>Pirú</b> no es parte [para] mandar estas piedras ni cerros.","197","","","","sin datos"
1338,"Piru","1","T01729","Estos <i>yngas</i> siempre desearon bolver a recuperar estos <i>reinos</i> por los medios posibles, y lo han intentado y, no hallando otro de más comodidad que su religión y resucitar su predicación, procuraron indios ladinos criados entre nosotros y los metieron allá dentro on dádivas y promesas.  E a estos los <i>derramaron</i> por todas las <i>provincias</i> del <b>Pirú</b>, con un modo y predicación rogando y exsortando a todos los que eran fieles a su <i>señor</i> que <i>señor</i> que creyesen que las <i>guacas</i> bolvían ya sobre sí y llevavan en vencida al Dios de los cristianos, que hiziesen el dever e que sacasen a su <i>señor</i> natural de las montañas donde estava desterrado.","215","","","","sin datos"
1339,"Pisco","1","T01730","<i>Cuntu</i>, <i>guaca</i> de los indios de <i>Piscoy</i>, es una piedra questá metida en la mar, junto al pueblo de <b>Pisco</b>.  ","213","","","","sin datos"
1339,"Pisco","1","T01731","<i>Runcari</i>, <i>guaca</i> de los dichos indios <i>piscos hurinsayas</i>, es un cerro pequeño junto al pueblo de <b>Pisco</b> y es una piedra que está enterrada en el dicho cerro.","213","","","","sin datos"
1340,"piscos hurinsayas","1","T01732","<i>Runcari</i>, <i>guaca</i> de los dichos indios <b>piscos hurinsayas</b>, es un cerro pequeño junto al pueblo de <i>Pisco</i> y es una piedra que está enterrada en el dicho cerro.","213","","","","sin datos"
1341,"Piscoy","1","T01733","<i>Cuntu</i>, <i>guaca</i> de los indios de <b>Piscoy</b>, es una piedra questá metida en la mar, junto al pueblo de <i>Pisco</i>.","213","","","","sin datos"
1342,"Piuni guaca","1","T01734","<b>Piuni guaca</b>, piedra en la ladera del cerro.","205","","","","sin datos"
1343,"Ploya","1","T01735","<i>Guachaca</i>, <i>guaca</i> de los indios <i>Chachapoyas</i> del <i>ayllo</i> de <b>Ploya</b>, es una <i>casa</i> en un cerro que se llama <i>Gallasa</i> junto al pueblo de <i>Lapal</i>.  Ay muchas más en esta <i>provincia</i>.","212","","","","sin datos"
1344,"Pomacamas","1","T01736","<b>Pomacamas</b>, <i>guaca</i> prencipal de los indios <i>guamachucos</i> de la <i>parcialidad</i> de <i>guacapongo</i>.  Era una piedra en un cerro junto al pueblo de <i>guacapongo</i>. ","210","","","","sin datos"
1345,"Pomallata","1","T01737","<i>Puna</i> es <i>guaca</i> de los <i>puruaes</i>.  Está junto al pueblo de <b>Pomallata</b>.","211","","","","sin datos"
1346,"Pongo","1","T01738","<i>Pancha guanacauri</i>, una piedra questá en un cerro que se llama <i>Pancha</i>, junto a la laguna de <b>Pongo</b>.  <i>Racra guanacauri</i> es una <i>guaca</i> puesta en otro cerro frontero de la dicha.","206","","","","sin datos"
1347,"Pozan","1","T01739","<b>Pozan</b>, <i>guaca</i> de los dichos <i>Chachapoyas</i> del <i>ayllo</i> <i>Coyllac</i>, es un árbol sobre un cerro junto al pueblo de <i>Coyllap</i>.  ","212","","","","sin datos"
1348,"Pra","1","T01740","<i>Cuychacolla</i>, <i>guaca</i> de los indios sobredichos del <i>ayllo</i> de <b>Pra</b>, ques una lagunilla junto al pueblo de <i>Llaucamalla</i>. Es <i>pacarisca</i> de los <i>chuhayayas</i>.","212","","","","sin datos"
1349,"principales","1","T01741","Ay otros géneros de <i>guacas</i> que se llaman <i>yllapas</i>, que son cuerpos muertos embalsamados de algunos pasados suyos <b>principales</b>, a los cuales reverencian y mochan.  Esta no es mocha general sino particular de la <i>parcialidad</i> o <i>ayllo</i> que descienden de los tales muertos.  De este nombre de <i>yllapa</i>, hay otras <i>guacas</i> que son los lugares donde caen rayos del cielo, y de tal manera reverencian estos lugares, que en la <i>casa</i> que da el rayo, la cierran con todo lo que está dentro y no tocan a ella ni se aprovechan de ella.","196","","","","sin datos"
1349,"principales","1","T01742","En especial sobre los <i>taquies</i>, bailes que hazen, porque se emborrachan cuando salen de sus pueblos a otras <i>provincias</i> y que son otros confines y los que hazen a la buelta a honra de sus <i>guacas</i>.  Sobre la <i>cachua</i> general o particular y la suprestición que tienen y ansimismo sobre las ceremonias que hazen en los entierros cuando se mueren sus <b>principales</b>.","202","","","","sin datos"
1349,"principales","1","T01743","Ay otros géneros de <i>guacas</i> que se llaman <i>yllapas</i>, que son cuerpos muertos embalsamados de algunos pasados suyos <b>principales</b>, a los cuales reverencian y mochan.  Esta no es mocha general sino particular de la <i>parcialidad</i> o <i>ayllo</i> que descienden de los tales muertos.  De este nombre de <i>yllapa</i>, hay otras <i>guacas</i> que son los lugares donde caen rayos del cielo, y de tal manera reverencian estos lugares, que en la <i>casa</i> que da el rayo, la cierran con todo lo que está dentro y no tocan a ella ni se aprovechan de ella.","196","","","","sin datos"
1349,"principales","1","T01744"," Sobre la <i>cachua</i> general o particular y la suprestición que tienen y ansimismo sobre las ceremonias que hazen en los entierros cuando se mueren sus <b>principales</b>.","202","","","","sin datos"
1350,"provincia/provincias","1","T01745","Ase de considerar que, antes que los <i>yngas</i>, <i>señores</i> que conquistaron desde la <b>provincia</b> del <i>Cuzco</i> hasta <i>Chile</i> y hasta <i>Pasto</i>, en los naturales de esta tierra nunca ovo govierno ni lengua general sino por <b>provincias</b> a las quales governavan por subcesión los indios de más valor y tenían todas las <b>provincias</b> sus <i>guacas</i> <i>adoratorios</i> en el orden que diré:","194","","","","sin datos"
1350,"provincia/provincias","1","T01746","Después que los <i>yngas</i>, dende el primero hasta el postrero conquistaron todas las <b>provincias</b> que se incluyen desde <i>Chile</i> a <i>Pasto</i>, a unas con armas, a otras con insidias y dádivas y promesas, ansí como procurava [n] saver  luego la cantidad de toda la gente de la <i>provincia</i> de las cosas que se sustentavan, posesiones, oro y plata y ropa que tenían, procurava[n] saver las <i>guacas</i>, <i>adoratorios</i> que adoravan y el orden que tenían en el ofrecerle y sacrificarle y de las posesiones y servicio que tenían, y siempre [el <i>ynga</i>] dio orden que las sustentasen con el orden de antes.","194","","","","sin datos"
1350,"provincia/provincias","1","T01747","Los <i>yngas</i> como subcedían los unos a los otros fueron inbentando muchos géneros de <i>guacas</i> que generalmentemandó que las adorasen en toda la tierra que poseyó, de las cuales dio en todas o las más <b>provincias</b>, conforme a la posibilidad de la tierra cuyos nombres porné muchos, y de cada un nombre.  Ay muchas en toda la tierra, unas bencidas como ellos llaman <i>atisca</i>, otras en pie.  A todas estas les dio servicios y <i>haziendas</i> y basos de oro y plata y a muchas <i>ganados</i> en la forma en que diré.","194-195","","","","sin datos"
1350,"provincia/provincias","1","T01748","Ay otros géneros de <i>guacas</i> a quién también dio servicio y <i>haziendas</i>, que pocas están descubiertas, aunque en la <b>provincia</b> de <i>Guamanga</i> descubrí algunas, que son, cuando iban los <i>yngas</i> conquistando, dexavan alguna uña cortada suya o alguna pieça de bestido suyo o pieça de armas o alguna ala de halcón.  [D]esta ala de halcón usa dicha cirimonia, que a los que vencía, escogía a uno a quien dexava en su lugar y le dezía:-Hazid desta ala de halcón bivo y tirad della hasta que saquéis-; queda el <i>ynga</i> con la una y al que nombrava con la otra, y deziale:-mirad como esta ave es la más noble y leal de las aves, ansí lo has de ser conmigo, que me fío de ti-","195","","","","sin datos"
1350,"provincia/provincias","1","T01749","Han tenido y reverenciado mucho a estas <i>guacas</i>; hállelas en los <i>soras</i> y en los <i>rucanas</i>, en los unos y en los otros, y en los <i>angaras</i>.  Tuve notiscia haverlas en <i>Xauxa</i> y en otras <b>provincias</b> de <i>Chinchaysuyo</i> por donde fue conquistado <i>Guaman Inga</i>.","195","","","","sin datos"
1350,"provincia/provincias","1","T01750","Ay, como dixe arriba, el prencipal género de <i>guacas</i> que antes que fuesen subjetos al <i>ynga</i> tenían, que llaman <i>pacariscas</i>, que quieren dezir criadoras de sus naturalezas.  Son en diferentes formas y nombres conforme a las <b>provincias</b>: unos tenían piedras, otros fuentes y rios, otros cuebas, otros animales y aves e otros géneros de árboles y de yervas y desta diferencia tratavan ser criados y descender de las dichas cosas, como los <i>yngas</i> dezia[n] ser salidos de <i>Pacaritambo</i>, ques de una cueba que se dize <i>Tambo Toco</i> y los <i>angaraes</i> y <i>soras</i> descender de una laguna llamada <i>Choclo Cocha</i> y desta manera todas las <b>provincias</b> del <i>Pirú</i>, cada cual de su modo aplicando cualquiera de las cosas dichas a su nascimiento.","197","","","","sin datos"
1350,"provincia/provincias","1","T01751","Llámase <i>parcialidad</i> por el orden que el <i>ynga</i> les puso, en legiones que ordenó en las repúblicas y <b>provincias</b> que hizo, que fue nombrallas mayores y menores -que es negoscio largo tratar desto- que les intituló <i>hanan</i> o <i>hurin</i>, <i>hanansaya</i> o <i>hurinsaya</i>.  Ovo <i>parcialidad</i> de diez mil indios y de mil y ciento y de diez y de cinco y de la menor iba en recogimiento de la mayor y de la mayor a la menor.","198","","","","sin datos"
1350,"provincia/provincias","1","T01752","Ay entre estas <i>guacas</i> <i>pacariscas</i> muy muchas que reedificaron los <i>yngas</i>, dándoles muchos <i>mitimas</i> servicios que para este fin los mandava[n] de unas <b>provincias</b> a otras.  Dioles [el <i>ynga</i>] muchos <i>ganados</i> y basos de oro y plata como fue en toda la cordillera que mira al mar, en todo lo que conquistó, en especial a cerros de nieves y bolcanes que miran a el mar y que salen de los ríos que riegan muchas tierras que, en lo que yo e visitado, son las siguientes:","198","","","","sin datos"
1350,"provincia/provincias","1","T01753","Ase de entender quel orden del <i>ynga</i> para asegurar su tierra conquistada era poner estas nasciones que mudava de una parte a otra, que llamava <i>mitimas</i>, en forma que sirviesen a las <i>guacas</i> dichas <i>pacariscas</i> que el reedificava y [a] estos <i>mitimas</i> ponía un caudillo superintendente que llamava <i>tocricoc</i> para su govierno de los <i>mitimas</i> o de los naturales para que les diese aviso y sustentase a quietud la tal <b>provincia</b>.","199","","","","sin datos"
1350,"provincia/provincias","1","T01754","Traen e llevan estas pieças según son las <i>guacas</i>: si son fuentes en sus tierras, traen un baso de agua dellas y echándolos con grande cerimonia en otras fuentes donde fueron transplantados y pónenle el nombre de su <i>pacarisca</i> con mucha solemnidad y si es piedra pónenle la pieça de bestido que traen a otra piedra, y desta manera a todas las cosas que tienen por <i>pacariscas</i>, sin diferenciar a la de su naturaleza, la sirven y adoran, y e hallado en muchas <b>provincias</b> de <i>mitimas</i> este orden y no ay dubdar sino que lo que adoravan en sus tierras hazen a donde fueron puestos.","199","","","","sin datos"
1350,"provincia/provincias","1","T01755","E sacan a estos bailes en muchas <b>provincias</b> las divisas de los vencimientos de las naciones que han debelado, en especial de las armas del <i>ynga</i> y sus dibisas, ansí en bestidos como en armas, y de los <i>capitanes</i> valerosos que a avido entre ellos, como son sus bestidos axedrezados o con culebras pintadas que llaman <i>amaros</i>, o alguna porra de guerra que llaman <i>chambi</i>, o algún caracol que suena como trompeta o alguna lanza o adarga o otros géneros de armas o bestiduras que hayan sido del <i>ynga</i> o de algunos <i>capitanes</i>  porque las reverencian y mochan y a sola aquella figura hazen el baile o borrachera o <i>taqui</i> y lo aplican a otros huelgos que los padres les dan licencia, pidiéndolas fingidamente: y es cierto que sus bailes e <i>taquis</i> los conmutan a nuestras pasquas y fiestas sacando las divisas y otras sobre que se a de advertir.","199","","","","sin datos"
1350,"provincia/provincias","1","T01756","Tienen otro género de <i>guacas</i> que llaman <i>uilcas</i>, que aunque la <i>uilca</i> es un género de fruta ponçoñosa que nace y se da en los <i>Andes</i> tierra caliente, de hechura de una blanca de cobre de Castilla, cúranse y púrganse con ella y se entierran con ella en las más <b>provincias</b> de este <i>reino</i>.   Ase de advertir que unas figuras como carneros de madera y piedra y [que ] tienen un hueco como tintero, ques donde se muele esta <i>uilca</i>, se a de procurar buscar y destruir.  Llámase el tintero <i>uilcana</i> y la adoran y reverencian.  Es esta <i>uilcana</i> hecha de muchas diferencias de piedras hermosas y de maderas fuertes.  Tienen, fuera de esta <i>uilca</i>, otros muy muchos géneros de medicinas que les llaman <i>uilcas</i>, en especial de purgas.   Ay muchos géneros de médicos que todos son <i>hechizeros</i> que usan de curar e inbocan al demonio primero que comiencen a curar, y esto es cierto y…","200","","","","sin datos"
1350,"provincia/provincias","1","T01757","Vino esta denominación de un abuso que imbentaron unos <i>hechizeros</i> en una peña questá en <i>Paucara</i> en el <i>Collao</i>, donde se juntava[n] cuatro dellos los más nombrados de aquellas <b>provincias</b>, y con unas yervas a figura de tallos y el cavo con una paletilla como espatula de boticario, que los indios se la ponen en la caveça por plumas y gala, y con estas en las manos, començavan a llorar a inbocar sus <i>guacas</i>, dando golpes en un agujero de la dicha peña, que del humor de las yervas salían unos mosquitos y a estos llamavan <i>guacanqui</i> como a cosa salida llorando.  A estos guardavan y los traían los <i>yngas</i> y personas prencipales consigo para que los amasen las mujeres y para ser bien afortunados en guerra y en sus contrataciones;","200","","","","sin datos"
1350,"provincia/provincias","1","T01758","A este juego ganó el <i>ynga</i> muchas <b>provincias</b> a las <i>guacas</i> que ya se las avía dado.  Y los <i>camayos</i> de las <i>guacas</i>, permitía el <i>ynga</i> que jugasen las tales <b>provincias</b> con él por otras y se hazían perdedizos.  Y después de <i>ganados</i> por el <i>ynga</i> con este medio de juego, le satisfazía el <i>ynga</i> a las <i>guacas</i> y <i>camayos</i> con dalles tierras y <i>ganados</i> y otros servicios.  Son muchas las tierras que ganó a este juego de el <i>ayllar</i> el <i>machacuay</i>. ","201","","","","sin datos"
1350,"provincia/provincias","1","T01759","Ay muchas otras advertencias que por <b>provincias</b> se usan, que no son generales sino ritos y cerimonias de <b>provincias</b> particulares, de que tenían noticia muchos religiosos dotrineros, que todas es justo se remedien.","203","","","","sin datos"
1350,"provincia/provincias","1","T01760","En la <b>provincia</b> de <i>Parinacocha</i> reedificó la <i>pacarisca</i> <i>çaraçara</i> ques un cerro nevado; a ésta le puso servicio de dos mil <i>mitimas</i> que se an acavado algunos llamados <i>Chinchaysuyo</i> y le dio dozientas ovejas hembras con sus padres.  A avido grandísimo multiplico; tienen hasta el día de hoy <i>quipos</i> y memorias por sus hilos de los que an multiplicado y muerto.","198","","","","sin datos"
1350,"provincia/provincias","1","T01761","Y ansimismo mochan los valles de <i>Yucai</i>, <i>Calca</i> y <i>Lamai</i> a estas dichas <i>guacas</i>deste valle de <i>Saquixaguana</i>, sin las que tienen en sus pueblo[s] [y] <b>probincias</b> que se declaran.","206","","","","sin datos"
1350,"provincia/provincias","1","T01762","<i>Llahapalla</i> <i>guaca</i> de los indios <i>chancas</i> era una piedra bestida y tenía un agujero en el hombro y tenía <i>casa</i>.  Hallé más de otras dos mil <i>guacas</i> visitando esta <b>provincia</b>, que las que puede aver, mandé quemar y deshazer, y dejé memoria en los libros de fábricas que hize en las doctrinas.","207","","","","sin datos"
1350,"provincia/provincias","1","T01763","<i>Auqui uscuntayi</i>, <i>guaca</i> de los indios <i>soras</i>, era una piedra en un cerro que se llama ansí.  Halle en esta <b>provincia</b> grandísima suma de <i>guacas</i>por orden de los <i>taqui ongos</i> que en esta <b>provincia</b> castigué, y las destruí y quemé, y dexé memoria de los nombres y de cuantas en los libros que hize de fábricas y de los <i>camayos</i> que tenían.","207","","","","sin datos"
1350,"provincia/provincias","1","T01764","Visitando esta <b>provincia</b>, hallé muy mucha suma de <i>guacas</i> y las destruí y quemé, y dexé memoria en los libros que mandé hazer fábricas, con toda cuenta y razón.","207","","","","sin datos"
1350,"provincia/provincias","1","T01765","<i>Guallallo</i>, <i>guaca</i> prencipal de toda la <b>provincia</b> de <i>yauyos</i> y <i>Guancas</i>, es un cerro alto y nevado y hazia a los <i>Andes</i> de <i>Xauxa</i>.","208","","","","sin datos"
1350,"provincia/provincias","1","T01766","<i>Yanayacolca</i>, <i>guaca</i> muy prencipal de los indios <i>chiscai</i> de la <b>provincia</b> de los <i>atauillos</i>, es una piedra bestida de figura de indio.  Teníanle una <i>casa</i> en el pueblo de <i>Ciscai</i>.  <i>Nina uinchos</i>, <i>guaca</i> prencipal de los indios <i>urcos</i>, de los <i>atauillos</i>, es una piedra que tiene figura de indio.  Está en el dicho pueblo de <i>Urcos</i>.","209","","","","sin datos"
1350,"provincia/provincias","1","T01767","<i>Tumayricapac</i> es una piedra a manera de indio bestido.  Está en el pueblo de <i>Cochacaya</i>, <b>provincia</b> de <i>yaros</i>.","209","","","","sin datos"
1350,"provincia/provincias","1","T01768"," <i>Guachaca</i>, <i>guaca</i> de los indios <i>Chachapoyas</i> del <i>ayllo</i> de <i>Ploya</i>, es una <i>casa</i> en un cerro que se llama <i>Gallasa</i> junto al pueblo de <i>Lapal</i>.  Ay muchas más en esta <b>provincia</b>.","212","","","","sin datos"
1350,"provincia/provincias","1","T01769","<i>Pachacamac</i>, <i>guaca</i> prencipal de los indios de la dicha <b>provincia</b> de <i>Ychmay</i>, la más prencipal que ovo en este <i>reino</i>, era una zorra de oro que estava en un cerro, hecha a mano, junto al pueblo de <i>Pachacama</i>.  ","214","","","","sin datos"
1350,"provincia/provincias","1","T01770","Ase de entender questas dichas <i>guacas</i> son las más prencipales del <i>reino</i> , a quien los <i>yngas</i> reedificavan, adoravan y promovían a riquezas y servicio, que las que más hay en cada <b>provincia</b> son muy muchas, y cada cual dellas era aplicada a su efeto y las figuras dichas o muchas de ellas las que podían ser llevadas a las fiestas que hazían en el <i>Cuzco</i>, se llevaban en andas, aunque fuesen de las <b>provincias</b> de <i>Quito</i> y <i>Pasto</i>, en especial las que dezían que hablavan.","214-215","","","","sin datos"
1350,"provincia/provincias","1","T01771","Y a todos los sacrificavan hombres y mujeres y <i>ganados</i> e ofrescían bultos de oro y plata y de mollo y hazían otros sacrificios y fiestas y todas tenían <i>camayos</i> e criados y <i>chácaras</i> y <i>ganados</i> y basos, según la posibilidad de la <b>provincia</b> en questavan a la voluntad de los <i>yngas</i> de enriquecerlas.  Es necesario tener mucho cuidado en la exirpación dellas.","215","","","","sin datos"
