id_palabra,"Palabra","id_cronista","id_texto","cita","pagina","lengua","propuesta","nota","enlace"
1180,"Cuzco","1","T01300","<i>Curicancha</i>, en memoria de la del <b>Cuzco</b>, con estatua de piedra.","205","","","","sin datos"
1180,"Cuzco","1","T01301","<i>Maragoaçi guanacauri</i>, piedra donde hazían muchos sacrificios en reverencia del <i>Guanacauri</i> del <b>Cuzco</b>.","205-206","","","","sin datos"
1180,"Cuzco","1","T01302","Ase de entender questas dichas <i>guacas</i> son las más prencipales del <i>reino</i> , a quien los <i>yngas</i> reedificavan, adoravan y promovían a riquezas y servicio, que las que más hay en cada <i>provincia</i> son muy muchas, y cada cual dellas era aplicada a su efeto y las figuras dichas o muchas de ellas las que podían ser llevadas a las fiestas que hazían en el <b>Cuzco</b>, se llevaban en andas, aunque fuesen de las <i>provincias</i> de <i>Quito</i> y <i>Pasto</i>, en especial las que dezían que hablavan.","214-215","","","","sin datos"
1180,"Cuzco","1","T01303","Las primeras que eran de los <i>quechuas</i> de ciertas <i>provincias</i> de donde tomó el <i>ynga</i> la lengua general que mandó supiesen todos, que la suya natural nadie la hablava sino ellos, llamávanse <i>Chuquimoro</i>, <i>Chuquiguaraca</i>, <i>Apollmoca</i>, <i>Sutaya</i>.  Del rededor del <b>Cuzco</b>, <i>Coricancha</i>, <i>Guaynacauri</i>, <i>Nina soyuma</i>, <i>Topa amaro</i>,<i>Nina Amaro</i>, <i>Manducalla</i> e otras muchas.  Del <i>Collao</i> a <i>Titicaca</i>.  De <i>Parinacocha</i> a <i>Sarasara</i>, y de todas las <i>provincias</i> tomaron la más prencipal e de quien tenían los naturales notiscia, que las traían al <b>Cuzco</b> e que hablavan por sus meses, cuando hazían sus fiestas los <i>yngas</i>, como está dicho.  Esta notiscia alcanzaron en <i>Quito</i> y en toda la tierra.","216","","","","sin datos"
1180,"Cuzco","1","T01304","<i>Chimborazo</i>, <i>Chicchirazo</i>, <i>Carorazo</i>, <i>guacas</i> de los indios <i>pastos</i>.  Dióselas <i>Guainacapac</i>; llevó las denominacion [es] del <b>Cuzco</b>. ","213","","","","sin datos"
1180,"Cuzco","1","T01305","En particular se a de advertir que los <i>yngas</i> pusieron nombres a los meses, haziendo diferencia de un mes al otro y dividiendo sus bailes y borracheras por ellos, trayendo de todo el  <i>reino</i> las  <i>guacas</i> que hallavan a esta ciudad del <b>Cuzco</b> para las tales fiestas. [...]  Y en algunas fiestas destas se comulgavan con cierto género de masa que hazian de sangre de corderos e de niños y harina de <i>maíz</i> que llaman <i>çanco</i>, e creían quedar limpios; y usavan en ellas de todas sus galas y hazían muchos sacrificios a los meses del año.","203","","","","sin datos"
1180,"Cuzco","1","T01306","[…]  En estas <i>provincias</i>, visitándolos yo, hallé muy muchas <i>guacas</i> y <i>camayos</i> dellas y deshize muchas dellas, y otras quemé, y quedó orden y memoria en los libros que hize de fábricas, con el aviso que pude.  Fin del obispado del <b>Cuzco</b> hazia <i>Lima</i>.","208","","","","sin datos"
1181,"cuzcos","1","T01307","<i>Guaypon guanacauri</i>, piedra cerca de una laguna.  Aquí se horradavan las orejas los indios <b>Cuzcos</b>.","206","","","","sin datos"
1182,"Dichan","1","T01308","<b>Dichan</b>, <b>guaca</b> prencipal de los <i>caxamarcas</i> del <i>ayllo</i> <i>Cuyosmango</i>, era una piedra sobre un cerro junto al pueblo de <i>Sucat</i>.","211","","","","sin datos"
1183,"Gallasa","1","T01309","<i>Guachaca</i>, <i>guaca</i> de los indios <i>chachapoyas</i> del <i>ayllo</i> de <i>Ploya</i>, es una <i>casa</i> en un cerro que se llama <b>Gallasa</b> junto al pueblo de <i>Lapal</i>.  Ay muchas más en esta <i>provincia</i>.","212","","","","sin datos"
1184,"ganado/ganados","1","T01310","Los <i>yngas</i> como subcedían los unos a los otros fueron inbentando muchos géneros de <i>guacas</i> que generalmente mandó que las adorasen en toda la tierra que poseyó, de las cuales dio en todas o las más <i>provincias</i>, conforme a la posibilidad de la tierra cuyos nombres porné muchos, y de cada un nombre. Ay muchas en toda la tierra, unas bencidas como ellos llaman <i>atisca</i>, otras en pie.  A todas estas les dio servicios y haziendas y basos de oro y plata y a muchas <b>ganados</b> en la forma en que diré.","194-195","","","","sin datos"
1184,"ganado/ganados","1","T01311","Ay en la dicha cordillera en <i>Condesuyo</i> otra que se llama <i>Sulimana</i> reedificada de los propios <i>ingas</i> con la propia autoridad de servicio <i>mitimas</i> y <b>ganado</b>.","198","","","","sin datos"
1184,"ganado/ganados","1","T01312","Todas las más <i>guacas</i> dichas tienen servicios y <i>chácaras</i> e <b>ganados</b>, y bestidos y tienen sus órdenes particulares de sus sacrificios y <i>moyas</i> que son dehesas donde apacientan los <b>ganados</b> de las dichas <i>guacas</i> y tienen gran cuenta con todo.","198","","","","sin datos"
1184,"ganado/ganados","1","T01313","Ay entre estas <i>guacas</i> <i>pacariscas</i> muy muchas que reedificaron los <i>yngas</i>, dándoles muchos <i>mitimas</i> servicios que para este fin los mandava[n] de unas <i>provincias</i> a otras.  Dioles [el <i>ynga</i>] muchos <b>ganados</b> y basos de oro y plata como fue en toda la cordillera que mira al mar, en todo lo que conquistó, en especial a cerros de nieves y bolcanes que miran a el mar y que salen de los ríos que riegan muchas tierras que, en lo que yo e visitado, son las siguientes:","198","","","","sin datos"
1184,"ganado/ganados","1","T01314","Y ase de entender que, fuera de los <i>mitimas</i> y servicios quel <i>ynga</i> dio a las dichas <i>guacas</i>, tienen otros servicios que llaman criados o <i>camayos</i>, que sirven de guardar las dichas <i>guacas</i> y sus <i>haziendas</i>, fuera de los guardadores del <b>ganado</b>. En estos criados ban subcediendo los hijos o nietos de los tales, y ansí no se pierde la memoria. E cuando fallescen, la nasción de unos, los <i>curacas</i>, les ofrescen otros que entre ellos parescen ser religiosos. ()","200","","","","sin datos"
1184,"ganado/ganados","1","T01315","A este juego ganó el <i>ynga</i> muchas <i>provincias</i> a las <i>guacas</i> que ya se las avía dado.  Y los <i>camayos</i> de las <i>guacas</i>, permitía el <i>ynga</i> que jugasen las tales <i>provincias</i> con él por otras y se hazían perdedizos. Y después de <b>ganados</b> por el <i>ynga</i> con este medio de juego, le satisfazía el <i>ynga</i> a las <i>guacas</i> y <i>camayos</i> con dalles tierras y <b>ganados</b> y otros servicios. Son muchas las tierras que ganó a este juego de el <i>ayllar</i> el <i>machacuay</i>. ","201","","","","sin datos"
1184,"ganado/ganados","1","T01316","Y a todos los sacrificavan hombres y mujeres y <b>ganados</b> e ofrescían bultos de oro y plata y de <i>mollo</i> y hazían otros sacrificios y fiestas y todas tenían <i>camayos</i> e criados y <i>chácaras</i> y <b>ganados</b> y basos, según la posibilidad de la <i>provincia</i> en questavan a la voluntad de los <i>yngas</i> de enriquecerlas. Es necesario tener mucho cuidado en la exirpación dellas.","215","","","","sin datos"
1184,"ganado/ganados","1","T01317","Y tratavan del mucho valor que <i>Topa amaro</i> tenía e de cómo los honraría, defendería e ampararía, e que creyesen que las <i>guacas</i> estavan ya desenoxadas, e que cada día embiavan sus mensajes a su <i>señor</i> el <i>ynga</i>.  Y los nombres de las <i>guacas</i> que predicaban porné aquí algunas dellas que eran las generales que más reverenciavan y adoravan, e a quien el <i>ynga</i> avía enriquecido con servicios, tierras y <b>ganados</b>","215-216","","","","sin datos"
1184,"ganado/ganados","1","T01318","Destos dogmatizadores del diablo tomé el principio de saber preguntar y descubrir las <i>guacas</i> e <i>camayos</i> dellas y no me metí en saber las <i>haziendas</i> por la poca autoridad que tenía en les apremiar para esto y para que entendiesen los naturales que no pretendía más de la salvación de sus ánimas, apartándoles de sus supresticiones.  De manera que por lo dicho los curas cristianos y zelosos de la honra de Dios que quieren hazer bien sus oficios, les será fácil el saver las <i>guacas</i> que puede aver en su distrito y los <i>camayos</i> que tienen y el orden que tenían en hazelles sacrificios y fiestas y la <i>hazienda</i> que poseyeron las <i>chácaras</i> y <b>ganados</b> y basos y ropas.","217","","","","sin datos"
1184,"ganado/ganados","1","T01319","Procurar saver cuáles fueron las <i>moyas</i>; que son dehesas aplicadas a estos <b>ganados</b>, y visitarlas los clérigos; y no se les haga travajoso, que les darán buenos corderos.  [...] Y suelen ocultar en las dichas <i>moyas</i> e casillas que en ellas tienen muchas <i>guacas</i>, en especial las <i>yllas llamas</i> que e dicho; y ansimismo por esta orden [se irán] descubriendo las mamas que son madres de las mismas, que arriba dixe.  Se pueden descubrir dellas las minerales de donde salieron, que será de mucha importancia para el servicio de su majestad y bien de las comunidades de cuyos nombres de minas y de los guardadores dellas y de los <b>ganados</b>, tengo muchos memoriales.  ","218","","","","sin datos"
1184,"ganado/ganados","1","T01320","Aunque pienso dar fastidio diré una niñería y patraña que los naturales de los confines de <i>Lima</i> tienen en la sierra, como ban a <i>Guadocherí</i> de acá, en todas las lagunas antes que llegan a Las Escaleras, y es que naturaleza en aquellas peñas, en la traviesa dellas que atraviesa el <i>camino real</i> de una legua a otra, crío una beta de mármol blanco de longitud larga.  Y los naturales cercanos a ella creen y dizen que, cuando los españoles entraron en estos <i>reinos</i>, salió de la una laguna la culebra llamada <i>amaro</i> para irse a la otra y con la nueva se enfrió y se tornó piedra.  Tiene señal de culebra, porque yo la e visto. Todas las <i>provincias</i> alrededor la mochan, cuando pasan por allí, con mucha reverencia.  Dízese tener en los <i>yauyos</i> muchos servicio[s] y <b>ganados</b> y <i>chácaras</i> que le an ofrescido y en <i>Guadochirí</i> y en los pueblos allí comarcanos.  Yo e visto encima della muchos <i>acollicos</i> y ofrescimientos todas las bezes que por allí e pasado.","201","","","","sin datos"
1184,"ganado/ganados","1","T01321","Y ansimismo en los <b>ganados</b> de la tierra que llaman <i>llamas</i>, se hallan unas piedras que nosotros llamamos besares, que en alguna[s] dellas hay piedras de grandor y pesso; a éstas las han guardado y guardan donde hay <b>ganados</b> de la tierra y las mochan con mucha reverencia llamándolas <i>yllas llamas</i>.  He hallándolas en muchas <i>provincias</i> donde tienen tienen <b>ganados</b> y hécholas quemar, porque usan de muchas supresticiones con ellas y crehen que, mochando a esta piedra, ninguna oveja abortará, ni subçederá mal a ninguno de sus <b>ganados</b> ni le dará <i>carache</i>, ques un género de sarna que le da al <b>ganado</b> de la tierra.","195-196","","","","sin datos"
1184,"ganado/ganados","1","T01322","Todas reconoscieron en esta <i>guaca</i> <i>pacarisca</i>, sin otras muchas particulares y sin las generales que los <i>yngas</i> les pusieron, demás que tenían otras <i>guacas</i> para el principio de labrar las tierras y otras para el sembrar, otras quando granan las sementeras y otras para quando las coxen y para cuando tresquilan los <b>ganados</b> y para cuando los hechan a los padres y para cuando paren.  Todas las dichas <i>guacas</i> son diferenciadas en nombres y servicios y ceremonias conforme a las <i>provincias</i>.","198","","","","sin datos"
1184,"ganado/ganados","1","T01323","Y en los <b>ganados</b> questas <i>guacas</i> tenían, advertir que aunque estén en título de comunidad, que es ansí quel más <b>ganado</b> que llaman de comunidad es de las <i>guacas</i>, se conoscerán en que dexan muchos [carneros] sin cortar la lana dende que nascieron. Procurar que se tresquilen porque los mochan y todas las manadas donde están carneros machos o hembras desta manera fueron de <i>guacas</i>.","218","","","","sin datos"
1185,"guaca/guacas","1","T01324","<i>Ancouilca</i>, <b>guaca</b> prencipal de los indios <i>guanocos pincos</i>, es una piedra questá en un cerro pequeño junto al pueblo de <i>Pincos</i>.    <","209","","","","sin datos"
1185,"guaca/guacas","1","T01325","<i>Chauin</i>, <b>guaca</b> prencipal de los indios <i>guanocos pincos</i>, es una piedra questá en un cerro pequeño junto al pueblo de <i>Pincos</i>.","209","","","","sin datos"
1185,"guaca/guacas","1","T01326","<i>Chauin</i>, <b>guaca</b> prencipal de los indios <i>guariguanocos</i>, es una piedra questá en una plaça que se llama <i>Ayas pampa</i>.  Llámase el pueblo <i>Ayas</i>.","209","","","","sin datos"
1185,"guaca/guacas","1","T01327","<i>Yamoc Zuya</i>[?], <b>guaca</b> de las más prencipales del <i>reino</i>  de los yndios <i>caxamalcas</i>, es una piedra larga questá en un cerro que se llama <i>Yamoc</i>.","210","","","","sin datos"
1185,"guaca/guacas","1","T01328","<i>Yanay guanca</i>, <b>guaca</b> prencipal de los indios <i>caxamalcas</i>.  Es una piedra en un cerro grande questá junto al pueblo de <i>Quinua</i>. ","210","","","","sin datos"
1185,"guaca/guacas","1","T01329","<i>Apoparato</i>, <b>guaca</b> de los indios <i>caxamalcas</i> del <i>ayllo</i> <i>Caxas</i>, es un bolcán que está cerca al pueblo de <i>Caxas</i>.","210","","","","sin datos"
1185,"guaca/guacas","1","T01330","<i>Angasquispi</i>, <b>guaca</b> de los indios <i>caxas</i>, es una piedra que dicen que andava vestida en un cerro junto el pueblo de <i>Biena</i>. ","210","","","","sin datos"
1185,"guaca/guacas","1","T01331","<i>Quispi</i>, <b>guaca</b> prencipal destos indios <i>caxamarcas</i> del <i>ayllo</i> <i>Cuyosmango</i>, era una peña de donde nasce agua y xripstales, en un cerro junto al pueblo de <i>Sanchadas</i>.","210","","","","sin datos"
1185,"guaca/guacas","1","T01332","<i>Utaran</i>, <b>guaca</b> de los dichos indios de <i>Cuyosmango</i>, son unas piedras de xripstal.  Están en un cerro que se dize <i>Utaran</i> junto al pueblo <i>Malcadan</i>.","211","","","","sin datos"
1185,"guaca/guacas","1","T01333","<i>Coan</i> <b>guaca</b> prencipal de los dichos <i>caxamarcas</i> del <i>ayllo</i> <i>Cuyosmango</i>.  Es un cerro grande nevado y en él una cueba ques la <i>guaca</i> junto al pueblo <i>Sucnaque</i>.","211","","","","sin datos"
1185,"guaca/guacas","1","T01334","<i>Barasuybira</i>, <b>guaca</b> de los <i>cañares</i> del <i>ayllo</i> de <i>Guayllasi</i>, es una piedra questá en el cerro <i>Barasuibirai</i>, junto al pueblo de <i>Guallas</i>.","211","","","","sin datos"
1185,"guaca/guacas","1","T01335","<i>Uisiguiumai</i> es <b>guaca</b> de los indios <i>cañares</i> del <i>ayllo</i> de <i>Paycara</i>.  Es un cerro grande, [hay] en él unas piedras junto al pueblo de <i>Anucñoc</i>.  ","211","","","","sin datos"
1185,"guaca/guacas","1","T01336","<i>Biccinca</i>, <b>guaca</b> prencipal de los indios <i>quitos</i>, es un cerro nevado alto junto a la ciudad de <i>Quito</i>.  ","213","","","","sin datos"
1185,"guaca/guacas","1","T01337","<i>Yllinca</i>, <b>guaca</b> prencipal de los dichos indios <i>quitos</i>, es un cerrillo pequeño nevado, junto al pueblo de <i>Panza liubu</i>.  ","213","","","","sin datos"
1185,"guaca/guacas","1","T01338","<i>Andazana</i>, <b>guaca</b> de los dichos <i>quitos</i> de la <i>parcialidad</i> <i>Quinigui</i>, es un cerrillo pequeño. Está en él una piedra pequeña.","213","","","","sin datos"
1185,"guaca/guacas","1","T01339","<i>Apocatiquillay</i>, <b>guaca</b> de las más prencipales del <i>reino</i> , de los indios <i>guamachucos</i>.  Era unas piedras altas en un llano, y como en el aire encima destas, cerca del pueblo de <i>Uruchalla</i>.  ","210","","","","sin datos"
1185,"guaca/guacas","1","T01340","<i>Pomacamas</i>, <b>guaca</b> prencipal de los indios <i>guamachucos</i> de la <i>parcialidad</i> de <i>guacapongo</i>.  Era una piedra en un cerro junto al pueblo de <i>guacapongo</i>.","210","","","","sin datos"
1185,"guaca/guacas","1","T01341","<i>Guaracayoc</i>, <b>guaca</b> de los indios <i>guamachucos</i>, era su <i>pacarisca</i>. ","210","","","","sin datos"
1185,"guaca/guacas","1","T01342"," <i>Namuday</i>, <b>guaca</b> de los indios <i>guamachucos</i>, del <i>ayllo</i> <i>Llampa</i>.  Es una peña en una quebrada que se llama <i>Quichuas</i>, cerca de un pueblo llamado <i>Ala</i>.","210","","","","sin datos"
1185,"guaca/guacas","1","T01343","<i>Callacalla</i> es <b>guaca</b> de los dichos <i>Chachapoyas</i>[sic: .] <i>Cochabamba</i> es una piedra en un cerro que se llama <i>Callacalla</i>, tres leguas del pueblo <i>Cochabamba</i>.  ","212","","","","sin datos"
1185,"guaca/guacas","1","T01344","<i>Checa</i>, <b>guaca</b> de los dichos <i>Chachapoyas</i> del <i>ayllo</i> <i>Salsac</i>, es una fuente junto al pueblo de <i>Salsac</i>. ","212","","","","sin datos"
1185,"guaca/guacas","1","T01345","<i>Pozan</i>, <b>guaca</b> de los dichos <i>Chachapoyas</i> del <i>ayllo</i> <i>Coyllac</i>, es un árbol sobre un cerro junto al pueblo de <i>Coyllap</i>.","212","","","","sin datos"
1185,"guaca/guacas","1","T01346","<i>Guixicoc</i>, <b>guaca</b> de los dichos <i>Chachapoyas</i> del <i>ayllo</i>  [......].  ","212","","","","sin datos"
1185,"guaca/guacas","1","T01347","<i>Guachaca</i>, <b>guaca</b> de los indios <i>Chachapoyas</i>. ","212","","","","sin datos"
1185,"guaca/guacas","1","T01348","<i>Guachaca</i>, <b>guaca</b> de los indios <i>Chachapoyas</i> del <i>ayllo</i> de <i>Ploya</i>, es una <i>casa</i> en un cerro que se llama <i>Gallasa</i> junto al pueblo de <i>Lapal</i>.  Ay muchas más en esta <i>provincia</i>.","212","","","","sin datos"
1185,"guaca/guacas","1","T01349","<i>Apomalmagura</i>, <b>guaca</b> de los indios <i>omasayos</i>, piedra a figura de indio.  ","207","","","","sin datos"
1185,"guaca/guacas","1","T01350","<i>Guamani</i> <b>guaca</b>, de los dichos <i>omasayos</i>, era un agujero en una ladera junto al pueblo de <i>Chuerqui</i>.","207","","","","sin datos"
1185,"guaca/guacas","1","T01351","<i>Urauilca</i>, <b>guaca</b> prencipal de loss dicho <i>atauillos</i>, es una piedra como indio.  ","208-209","","","","sin datos"
1185,"guaca/guacas","1","T01352","<i>Chuquimango</i>, <b>guaca</b> prencipal de los dichos <i>atauillos</i>, es una piedra questá en un cerro que se llama anssí.  Está encima del pueblo de <i>Pampas</i> de Montenegro. ","209","","","","sin datos"
1185,"guaca/guacas","1","T01353","<i>Yarouilca</i>, <b>guaca</b> prencipal de los dichos <i>atauillos</i>, es un cerro nevado grande, junto al pueblo de <i>Hallaoca</i>.","209","","","","sin datos"
1185,"guaca/guacas","1","T01354"," <i>Yanayacolca</i>, <b>guaca</b> muy prencipal de los indios <i>chiscai</i> de la <i>provincia</i> de los <i>atauillos</i>, es una piedra bestida de figura de indio.  Teníanle una <i>casa</i> en el pueblo de <i>Ciscai</i>. ","209","","","","sin datos"
1185,"guaca/guacas","1","T01355"," <i>Ninca uinchos</i>, <b>guaca</b> prencipal de los indios <i>urcos</i>, de los <i>atauillos</i>, es una piedra que tiene figura de indio.  Está en el dicho pueblo de <i>Urcos</i>.","209","","","","sin datos"
1185,"guaca/guacas","1","T01356","<i>Urpai guachac</i> es una isla <b>guaca</b> de los pescadores de <i>Chincha</i>.  Dezía ser mujer de <i>Pachacama</i>.   ","214","","","","sin datos"
1185,"guaca/guacas","1","T01357","<i>Chinchaycama</i>, <b>guaca</b> prencipal, su <i>pacarisca</i>.","214","","","","sin datos"
1185,"guaca/guacas","1","T01358"," <i>Aucambi caxqcuyoc</i>, <i>Sulca camoy</i>, <i>Sulcam Lacxa guaraca</i>, <b>guacas</b> alrededor del pueblo de <i>Chincha</i> de ambas <i>parcialidades</i>. ","214","","","","sin datos"
1185,"guaca/guacas","1","T01359","<i>Sasaylla apo</i>, <b>guaca</b> de las muy prencipales del <i>reino</i> .  Es una cueba detrás del pueblo de <i>Parcos</i>, en una ladera. ","208","","","","sin datos"
1185,"guaca/guacas","1","T01360","<i>Caroamcho</i>[?], <b>guaca</b> de los indios <i>angaraes</i>, es un cerro frontero del pueblo de <i>Paucararay</i>. ","208","","","","sin datos"
1185,"guaca/guacas","1","T01361","<i>Jorai</i>, <b>guaca</b> de los indios <i>pariscas</i> de Diego Favilán.  Es un cerro nevado junto al pueblo de <i>Paucarbamba</i>. ","208","","","","sin datos"
1185,"guaca/guacas","1","T01362","En estas <i>provincias</i>, visitándolos yo, hallé muy muchas <b>guacas</b> y <i>camayos</i> dellas y deshize muchas dellas, y otras quemé, y quedó orden y memoria en los libros que hize de fábricas, con el aviso que pude.  Fin del obispado del <i>Cuzco</i> hazia <i>Lima</i>.","208","","","","sin datos"
1185,"guaca/guacas","1","T01363","<i>Apallisca</i>, <b>guaca</b> prencipal de los dichos <i>atauillos</i>, es una piedra en un cerro alto, junto al pueblo de <i>Quipan</i>.","208-209","","","","sin datos"
1185,"guaca/guacas","1","T01364","Ase de considerar que, antes que los <i>yngas</i>, <i>señores</i> que conquistaron desde la <i>provincia</i> del <i>Cuzco</i> hasta <i>Chile</i> y hasta <i>Pasto</i>, en los naturales de esta tierra nunca ovo govierno ni lengua general sino por <i>provincias</i> a las quales governavan por subcesión los indios de más valor y tenían todas las <i>provincias</i> sus <b>guacas</b> <i>adoratorios</i> en el orden que diré:","194","","","","sin datos"
1185,"guaca/guacas","1","T01365","Después que los <i>yngas</i>, dende el primero hasta el postrero conquistaron todas las <i>provincias</i> que se incluyen desde <i>Chile</i> a <i>Pasto</i>, a unas con armas, a otras con insidias y dádivas y promesas, ansí como procurava [n] saver  luego la cantidad de toda la gente de la <i>provincia</i> de las cosas que se sustentavan, posesiones, oro y plata y ropa que tenían, procurava[n] saver las <b>guacas</b>, <i>adoratorios</i> que adoravan y el orden que tenían en el ofrecerle y sacrificarle y de las posesiones y servicio que tenían, y siempre [el <i>ynga</i>] dio orden que las sustentasen con el orden de antes.","194","","","","sin datos"
1185,"guaca/guacas","1","T01366","Durante el govierno de los <i>yngas</i> hizieron cuatro veretas generales en toda la tierraque poseyesse[n], que los títulos dellas se intitulan <i>Chinchaysuyo</i>, <i>Collasuyo</i>, <i>Andesuyo</i>, <i>Condesuyo</i>, a los cuales les dio figuras y señal de bestidura y tocado con señales por donde eran conoscidos y <b>guacas</b> generales.","194","","","","sin datos"
1185,"guaca/guacas","1","T01367","Los <i>yngas</i> como subcedían los unos a los otros fueron inbentando muchos géneros de <b>guacas</b> que generalmentemandó que las adorasen en toda la tierra que poseyó, de las cuales dio en todas o las más <i>provincias</i>, conforme a la posibilidad de la tierra cuyos nombres porné muchos, y de cada un nombre.  Ay muchas en toda la tierra, unas bencidas como ellos llaman <i>atisca</i>, otras en pie.  A todas estas les dio servicios y <i>haziendas</i> y basos de oro y plata y a muchas <i>ganados</i> en la forma en que diré.","194-195","","","","sin datos"
1185,"guaca/guacas","1","T01368","Ay otros géneros de <b>guacas</b> a quién también dio servicio y <i>haziendas</i>, que pocas están descubiertas, aunque en la <i>provincia</i> de <i>Guamanga</i> descubrí algunas, que son, cuando iban los <i>yngas</i> conquistando, dexavan alguna uña cortada suya o alguna pieça de bestido suyo o pieça de armas o alguna ala de halcón.  [D]esta ala de halcón usa dicha cirimonia, que a los que vencía, escogía a uno a quien dexava en su lugar y le dezía:-Hazid desta ala de halcón bivo y tirad della hasta que saquéis-; queda el <i>ynga</i> con la una y al que nombrava con la otra, y deziale:-mirad como esta ave es la más noble y leal de las aves, ansí lo has de ser conmigo, que me fío de ti-","195","","","","sin datos"
1185,"guaca/guacas","1","T01369","Han tenido y reverenciado mucho a estas <b>guacas</b>; hállelas en los <i>soras</i> y en los <i>rucanas</i>, en los unos y en los otros, y en los <i>angaras</i>.  Tuve notiscia haverlas en <i>Xauxa</i> y en otras <i>provincias</i> de <i>Chinchaysuyo</i> por donde fue conquistado <i>Guaman Inga</i>.","195","","","","sin datos"
1185,"guaca/guacas","1","T01370","Ay otros géneros de <b>guacas</b>, a quién reverencian y sirven con mucho cuidado, que son de los frutos primeros que coxen de alguna tierra que no fue sembrada.  Escoxen el más hermoso fruto y le guardan y, a semejança dél, hizieron otros de piedras diferentes o de oro o plata, como una maçorza de <i>maíz</i> o una <i>papa</i> y les llaman <i>mamaçara</i> y <i>mamapapa</i>; y así a los demás frutos y en esta forma de todos los minerales de oro o plaza o azogue que antiquísimamente se han descubierto.  Y, primero que los vayan a labrar, el día que han de trabajar, mochan y beven a la tal piedra llamándola mama de lo que travajan.  He descubierto muchos dellos en todas las partes donde hay minas, en tierras de <i>Guamanga</i>.","195","","","","sin datos"
